{"schemaVersion":"v1","site":{"allowUnsafeEastWest":false},"environments":[{"env":"work","bridge":"br-work-lan","mtu":1500,"mssClamp":null,"lan":{"allowEastWest":false,"effectiveEastWest":false},"netVmForwardBlocklist":[],"bridgePortFlags":[{"role":"workload-lan","isolated":true,"neighSuppress":false,"rule":"default"}],"ipv6Sysctls":[{"ifName":"br-work-lan","disableIpv6":1,"acceptRa":0,"autoconf":0,"addrGenMode":1}],"usbipBusidLocks":[]}],"nftables":{"family":"inet","table":"d2b","chains":[]},"networkManager":{"filePath":"/etc/NetworkManager/conf.d/d2b.conf","matchCriteria":[],"reloadBehavior":"atomic-reload","ownership":{"owner":"root","group":"root","mode":"0644","driftPolicy":"replace"}},"hostsFile":{"startMarker":"# BEGIN D2B","endMarker":"# END D2B","rule":"replace"},"kernelModules":[],"fdOwnership":[],"cloudHypervisorCapabilities":[]}
