{"schemaVersion":"v1","site":{"allowUnsafeEastWest":false},"environments":[{"env":"work","bridge":"abcdefghijklmnop","mtu":1500,"mssClamp":null,"lan":{"allowEastWest":false,"effectiveEastWest":false},"netVmForwardBlocklist":[],"bridgePortFlags":[],"ipv6Sysctls":[],"usbipBusidLocks":[]}],"nftables":{"family":"inet","table":"nixling","chains":[]},"networkManager":{"filePath":"/etc/NetworkManager/conf.d/nixling.conf","matchCriteria":[],"reloadBehavior":"reload","ownership":{"owner":"root","group":"root","mode":"0644","driftPolicy":"replace"}},"hostsFile":{"startMarker":"# BEGIN NIXLING","endMarker":"# END NIXLING","rule":"replace"},"kernelModules":[],"fdOwnership":[],"cloudHypervisorCapabilities":[]}
